_id,area,content,count,date,likes,link,page,pk,title
364,北投區,杜鵑颱風中心今日凌晨出海，仍須慎防強驟豪雨，全台多縣市停班停課，攪局多項活動停辦、延期，以下為活動停辦一覽表。▉各地活動●台北市1.「搖滾天團邦喬飛(Bon Jovi)29日演唱會」取消退票資訊：退票延長期限至10/8，請於兩週期限內完成退票手續。(詳情請洽：https://www.facebook.com/livenationtw?fref=ts)2.松山文創園區9/29（二）全區閉園一天，園區各出入口封閉，所有展覽活動暫停。當期展演：「2015林美嬌創作展-鑲嵌畫、油畫、瓷畫」、「Ciao！部落！」、「全球傳達設計大賞 紅點設計獎獲獎作品特展」、「金鐘五十．響 特別展」。3.原訂9月29日早上10點舉辦的「與文人在貓空相遇」活動，因杜鵑颱風來襲，考量交通安全等因素而取消，後續舉辦地點及時間將另行通知。●桃園市1.桃園市立圖書館平鎮分館1F文化館「彩顏物語」，如遇颱風停展。2.復興區羅浮里小米園區Tayal Smyus泰雅祖靈祭取消（拉拉山輕旅行一併取消）。●台中市1.台中市政府原訂今天（29日）舉辦的「ACTION!台中愛上影、創意影片大賽」得獎作品放映會、「台中市政府行動專車大安場」、「創意台中活動」等均取消。2.市府法制局推出「台中市政府行動專車」原定今天上午10點至下午4點在大安區公所服務，受杜鵑颱風停班停課影響，活動取消，將再公布舉行日期。在清水眷村文化園區舉行的「創意台中活動」，今天主題展暫停開放，活動取消一天。●彰化市彰化縣政府原訂於9/29發放重陽敬老禮金，為避免因颱風後所帶來風雨，致長者出門產生危險，將延期發放。●嘉義市1.104年9月29日於嘉義市舊燈會區舉辦「城隍廟臨時行宮動土典禮」活動，將另擇期舉行。2.104年9月29日於市府大門口舉辦「鄰長腳踏車授贈典禮」活動，將另擇期舉行。3.104年9月29日原定於嘉義大學新民校區舉辦「嘉義市環保知識挑戰擂臺賽」活動暫時取消。4.104年9月29日原定於鎮南聖神宮舉辦「孔子盃書法比賽頒獎典禮」活動暫時取消。●高雄市駁二藝術特區上午休園，進行館舍和相關設施整理維護，開放時間延至13:00開放參觀。園區店家開放時間，請參考各店家網站公告。●澎湖縣原訂28日起至10月6日巡迴各社區辦理婦女乳房攝影及子宮頸抹片巡迴篩檢，因受颱風杜鵑影響，宣布取消，將另行安排檢查時間。▉各地遊樂園、風景區休園一覽表如下:●風景區1.東北角國家風景區預警性封閉景點：福隆海水浴場、龍洞灣潛水服務區、龍洞四季灣及港澳濱海遊憩區等4處。2.東海岸國家風景區預警性封閉景點：綠島三浮潛區及朝日溫泉等4處。3.北觀國家風景區預警性封閉景點：野柳地質公園1處。4.今天全台18個國家森林遊樂區:包含太平山、內洞、滿月圓、東眼山、觀霧、大雪山、八仙山、合歡山、武陵、奧萬大、阿里山、藤枝、墾丁、雙流、知本、向陽、池南及富源國家森林遊樂區全部休園，轄管步道也全數封閉。5.平地森林遊樂區包含大農大富、鰲鼓溼地及林後四林等3處強風豪雨易造成坍方落石，請民眾不要前往。6.東石漁人碼頭、布袋遊艇港及竹崎公園天空走廊暫停開放。7.「旭海-觀音鼻自然保留區」即刻起全面關閉並加強管制。8.台北市北投區泉源公園、復興公園及硫磺谷等3座泡腳池9月29日休園。●遊樂園1.台北市兒童新樂園9/29(二)全天暫停營運。2.台北市立動物園9/29(二)休園一天。3.六福村主題遊樂9/29(二)休園一天。4.小人國主題樂園9/29(二)休園一天。5.九族文化村因應南投縣政府宣佈停止上班，9/29(二)休園一天。●百貨1.台北101購物中心及觀景台今日將完成全面巡檢作業後，於中午1200開始營業，造成不便敬請見諒。2.新光三越台北四店、桃園兩店將延後至下午2點開始營業。若有調整，再另行公告。3.SOGO今日忠孝館、復興館、敦化館、天母店、中壢店、新竹站前店、新竹Big City店延後至13:30開始營業。高雄店正常營業。4.微風、京站11點正常開店。5.遠東百貨寶慶、Mega City板橋大遠百、板橋中山從中午12點半營業，Top City台中大遠百、花蓮正常11點營業。(中時電子報)出版編輯：簡怡欣,42,2015/09/29 00:00,1751,http://www.chinatimes.com/realtimenews/20150929001439-260401,7,ltn00365,全台各地活動停辦、延期一覽表
365,北投區,杜鵑過境，彰化沒有重大傷亡，卻再度飽嘗大停電之苦，從前晚颳起狂風，彰化縣停電戶數一度飆破逾19萬戶，昨天颱風從彰化芳苑出海遠颺，台電投入搶修，到昨天晚上仍有1萬多戶「不來電」。南投縣也沒有重大災情，但颱風夜有1萬5258戶電力中斷，造成民眾生活不便；奇怪的是，颱風夜停電，但颱風過後，南投地區的路燈，卻是亮整天。這次杜鵑過境，中台灣風雨最強時刻在凌晨，也讓傷害降到最小，彰化縣災害應變中心統計，民生、基礎設施災情160件、交通號誌損壞9件、建物毀損56件、路樹災情53件、廣告招牌災情68件、積淹水災情1件，其他災情39件，都已經陸續投入修復中。其中，大城鄉魚寮溪三林橋下游約300公尺處左岸的18號水門毀損，造成8米寬提案破口海水倒灌，現況災害情形初步已控制。另外，芳苑鄉漁港停車場至養殖區有淹水情形，業已拉起封鎖線，退潮時積水可排出，養殖部分由農業處處理，伸港六股抽水站也不敵大滿潮，附近也有好幾分農田被海水一浸泡，鹹度上升到2度，海水是3度。南投縣長林明溱29日主持防災會議，消防局長林聰吉在會中指出，杜鵑颱風對南投影響最大的是電力供應，全縣1萬多戶電力停電。停電主因是強風吹斷路樹，壓斷電線。林明溱請台電與消防、工務等單位聯繫，協助排除障礙，盡速恢復供電。(中國時報),43,2015/09/30 00:00,69,http://www.chinatimes.com/newspapers/20150930000518-260107,7,ltn00366,彰投數萬戶停電 台電搶修
366,北投區,一輛台鐵南下175車次自強號列車，行至台中潭子站竟停車長達7個多小時，數百旅客受困風雨中，讓旅客等也不是，不等也因風雨過大，加上人生地不熟，不知該如何處理，只能乾等在車上，直接23點42分左右才重新開車。帶著小孩返家的劉姓旅客投訴表示，等待時一直未告知情況，只告知旅客不想等可以改搭其它交通工具，颱風天又在潭子，也不知怎麼搭車？直到晚上8、9點又說要往回開，一下子又沒有消息，讓旅客等得累到半死，一顆心懸著不安，真的很不負責。劉姓旅客指出，詢問台鐵發車，僅說下午5點停駛，並未告知會中途停車，如果早知道，鐵路有受損，且會停這麼久，早就改搭其它交通運輸工具，現在被困在火車裡，又餓又渴又累，即使透過家人打電話，台鐵免付費服務專線一直占線，難以反映。記者查詢台鐵網站，28日從下午18點30分到23點30分只陸續發出四次公告，只說28日停駛時段，並未說明旅客受影響被困一事，即使到23點30分，僅表示路線因受杜鵑颱風影響有多處損害，29日多段路線停駛，卻隻字不提對受困旅客安置情況，引發不少民眾抱怨與等待家屬不安，痛罵天災應變亂七八糟。(旺報即時)出版編輯：簡恒宇,44,2015/09/29 00:00,1926,http://www.chinatimes.com/realtimenews/20150929000036-260405,7,ltn00367,台鐵颱風天災應變亂糟糟 乘客受困超過7小時
367,北投區,中度颱風「杜鵑」中心29日凌晨1時已從彰化縣芳苑鄉出海，台灣各地仍籠罩在暴風圈內，氣象局發布豪雨特報，農委會水保局也發出184條土石流紅色警戒，分別位於台中市和平區、新竹縣尖石鄉、台北市北投區、南投縣信義鄉、桃園市復興區、高雄市那瑪夏、六龜、桃源、雲林縣古坑鄉、新北市山區、嘉義縣，提醒山區民眾及早撤離。184條土石流紅色警戒，分布於台中市和平區平等里；新竹縣尖石鄉嘉樂村、秀巒村、新樂村、玉峰村；台北市北投區秀山里；南投縣信義鄉神木村、望美村、同富村、羅娜村；桃園市復興區華陵里、霞雲里、義盛里、羅浮里、高義里、奎輝里、三光里；高雄市那瑪夏區達卡努瓦里，六龜區新發里、興龍里、六龜里，桃源區勤和里、拉芙蘭里、復興里、梅山里、桃源里、建山里、高中里；雲林縣古坑鄉草嶺村。新北市包含石碇區烏塗里、永定里、潭邊里、格頭里，三芝區圓山里、店子里，新店區雙坑里，烏來區福山里、信賢里；嘉義縣則有竹崎鄉光華村、中和村、緞繻村、文峰村，梅山鄉瑞峰村、太和村、瑞里村、龍眼村，阿里山鄉新美村、豐山村、來吉村、達邦村、茶山村、山美村、樂野村、里佳村、十字村，番路鄉公興村、公田村、大湖村，大埔鄉永樂村、大埔村、和平村，中埔鄉東興村、石弄村等，地方政府應勸告或強制其撤離，並作適當之安置。(中時即時)出版編輯：林芳如,45,2015/09/29 00:00,991,http://www.chinatimes.com/realtimenews/20150929001289-260401,7,ltn00368,土石流紅色警戒 184條分布9縣山區
368,北投區,強颱杜鵑來襲，山區大量降雨致使新店溪濁度飆升，昨天晚間最高濁度達20500度。為避免蘇迪勒颱風的黃濁水惡夢再現，台北自來水事業處昨天下午4點30分，已依照SOP停止取水，影響擴大至大台北地區19萬直接用水戶。蛋白區先停 19萬戶衰根據北水處作業準則，直潭、長興、公館3座淨水場的原水濁度在6000～1.2萬度，採取減量取水，超過1.2萬度就會停止取水。昨天上午9點原水濁度僅220度，中午12點來到2500度，下午3點50分已達6200度，直潭、長興、公館3座淨水場隨即啟動減量取水措施，到了4點30分，濁度飆升至1.3萬度，淨水場因此停止取水，晚上8點已超過2萬度。　到了下午5點30分，北投、天母、木柵，以及新北市中永和、新店、汐止，有5.5萬戶停水；7點30分，再增加內湖、大直，共計8.3萬戶停水；10點30分，影響擴大至大台北地區19萬戶。供水站不均 新北辛苦台北自來水事業處陳錦祥說，昨晚風雨強勁，原水濁度未明顯下降，考量淨水場的負荷，決定繼續停水。他指出，目前受影響用戶，以接用地面水管的1樓店面或住家等直接用水戶為主，若淨水場停止取水時間達24小時，也就是說，今天下午4點30分原水濁度未降到1.2萬度以下，大台北地區153萬用水戶都要停水。為了方便民眾取水，大台北各行政區共設置21處緊急取水站（見表），今上午將會公布開放民眾取水的時間。值得注意的是，新北市有多個地區缺水，共計受影響的超過10萬戶，但取水站只有三重一處，新北市民要用水得跑遠一點。翡翠洩洪 濁度難改善雖然目前尚未宣布恢復供水時間點，但北水處估計，停水6小時的地區，恢復正常供水所需時間為3小時；停水12小時，恢復供水則要6小時；停水24小時，得花2天才能恢復供水。台水方面，管轄範圍內的原水濁度雖正常，但因停電關係，台中地區大約有1.2萬戶停水。翡翠水庫昨天下午1點開始，實施每秒約310立方公尺的調節性放水。台北翡翠水庫管理局科長王為森表示，因雨量過大，預計會持續洩洪至今天上午；不過洩洪僅為調節水庫水位，對於稀釋新店溪濁度效果不大。(中國時報),46,2015/09/29 00:00,23707,http://www.chinatimes.com/newspapers/20150929000329-260102,7,ltn00369,水濁2萬度 大台北停水
369,內湖區,從空降特戰（傘兵）退伍，轉行跨入房仲業，只花半年時間就賺到第一桶金（百萬），且在目前房地產景氣不佳，房仲業爆發倒店潮之際，還準備在明年開出第2家門市，他就是台灣房屋明湖特許加盟店店經理蔡凱倫。蔡凱倫61年次，南部嘉義人（故鄉雲林），從空特退伍後，原本做貿易的他，因產業外移至大陸，因不想去大陸工作，加上應酬喝太多酒，於是決定轉行做房仲。他說，會選擇做房仲是因為，該行業沒有背景、沒有特殊專業技能的人，都可賺到年薪百萬、成家立業、五子登科。民國88年入行，曾待過信義房屋、美商ERA，去年7月才轉招加入台灣房屋；他指出，會離開信義是因為直營店的工作型態，結婚後難以兼顧家庭；後來又發現房仲業走向品牌集團化，以及區域房仲整併的趨勢，因此選擇加入台灣房屋體系。蔡凱倫表示，民國87年是房地產最不景氣的時候，當年加入房仲時曾問過一位房仲超級業務，如何能達到百萬年薪？他只說了一句話：「每天晚上12點前不回家」。入行首年 每天衝到半夜因為這句話，蔡凱倫在一開始的1年2個月內，都沒有在12點前下班，也因為如此，他曾有1個月成交7筆物件紀錄，入行第4個月，單月佣收已破百萬，創下在汐止區單月業績破百的史上第2人。蔡凱倫指出，房仲業是高人力密集產業，工作時間長，但沒有其他行業，沒有背景、沒有特殊專業技能還能賺大錢，而且叫人買房子絕對沒錯，不僅可置產還可保值。現在蔡凱倫已是台灣房屋明湖特許加盟店店東，旗下團隊有20人，其中，高專獎金抽成50％，普專底薪5萬保障6個月，還可視業績抽成20～50％，因有高額獎金制度，加上彈性大，人員流動率低。蔡凱倫表示，客人不會因為房仲是直營或加盟店，對品牌要求變少，一般直營店提供的是標準化的服務，客人覺得是應該的，必須提供超出標準的服務，客戶才會感動。超值服務 抓住客戶的心他舉例，客戶買了房子之後，有漏水情況要處理，他的團隊會在師傅施工時，不僅監工，還會拍照，再將照片寄給客戶，客戶要有知的權利，才會有信賴感，這就是服務的深度及細膩度。蔡凱倫強調，現在房地產景氣不佳，體質不好的房仲會離開市場，轉加盟台灣房屋後，旗下團隊業績在北北基地區每季都會在前3名內，目前仍會順勢而為，預計明年開出第2家門市。達人小檔案現職：台灣房屋明湖特許加盟店店東房仲資歷：17年學歷：中國文化大學年齡：43歲達人座右銘逆風飛翔才會飛得更高成功銷售的第一步是客戶關係的建立，一般業務在接觸客戶後，常急著要去推銷產品，但蔡凱倫通常會先了解客戶的需求、背景及動機，站在客戶的立場去思考，也會聊聊自己。不要急著立刻衝到位，先跟客戶建立起信賴及默契，這常是後續是否成交的關鍵。達人看市場－利率不漲、房市不死當前房市普遍趨緩，蔡凱倫表示，北市房市將回歸基本需求，不會像以前一樣雞犬升天，但房市跟股市一樣，股市不好的時候也會有飆股，北市回歸產品特殊性，有價值的產品，什麼時候都可以買。目前在北市挑選物件，要看區域人口增長需求，像是內湖區連續12年人口保持正成長，帶來方便的生活機能，大直區也具備此種條件。蔡凱倫認為，北市房價其實沒有太多的跌幅，北市住宅租金投報率約1.6～1.8％，但銀行貸款利率也僅1.8％。若真的房價打8折賣，跟銀行借錢買投報率可達2.25％，賣出的屋主會後悔，「利率不漲、房市不死」。(工商時報),1,2015/10/24 00:00,3725,http://www.chinatimes.com/newspapers/20151024000264-260210,2,ltn00370,職場達人－拚命房仲蔡凱倫 半年賺一桶金
370,內湖區,當前房市普遍趨緩，蔡凱倫表示，北市房市將回歸基本需求，不會像以前一樣雞犬升天，但房市跟股市一樣，股市不好的時候也會有飆股，北市回歸產品特殊性，有價值的產品，什麼時候都可以買。目前在北市挑選物件，要看區域人口增長需求，像是內湖區連續12年人口保持正成長，帶來方便的生活機能，大直區也具備此種條件。蔡凱倫認為，北市房價其實沒有太多的跌幅，北市住宅租金投報率約1.6～1.8％，但銀行貸款利率也僅1.8％。若真的房價打8折賣，跟銀行借錢買投報率可達2.25％，賣出的屋主會後悔，「利率不漲、房市不死」。(工商時報),2,2015/10/24 00:00,383,http://www.chinatimes.com/newspapers/20151024000266-260210,2,ltn00371,達人看市場－利率不漲、房市不死
371,內湖區,三立電視台《甘味人生》劇組，昨日上午在北市內湖港墘路拍攝一場綁架戲時，10歲及7歲的童星闕銘佑、鍾宸翃不慎從貨車後車斗跌落地面，造成闕銘佑右手腕骨折，鍾宸翃臉部及身體多處擦傷，經送醫救治皆無大礙。台北市勞動檢查處今將約談相關人員，釐清詳細的狀況和責任歸屬。台北市勞動檢查處處長鄒子廉表示，經初步了解，當時2名童星坐在貨車後面拍戲，不料卻於車子開動時摔出車外，而此齣戲劇由映畫公司製作，出意外的車輛也由該公司提供。鄒子廉指出，根據《職業安全衛生設施規則》規定，雇主以貨車搭載勞工須維護相關安全，不能讓勞工坐在容易墜落的位置；初步看來業者應屬違規，若結果認定違規，將可處以3萬至30萬元罰緩。另雇用未滿15歲者，應向主管機關報備，這部分勞檢處會一併了解情況。昨天上午10時許，北市消防局獲報有人從拍攝現場車輛翻落，經前往發現2名童星闕銘佑、鍾宸翃受傷，意識均清醒，隨即送醫治療。據該劇導播向警方表示，當時是在拍攝綁架劇情時，「壯壯」鍾宸翃及「佑佑」闕銘佑2人坐在後車斗的最外緣，車上堆滿空紙箱，可能是因司機起步油門踩太急，2人才會重心不穩從車上翻落。2名童星的母親雖十分心疼，但表示製作單位有幫小朋友投保意外險，醫療費用將由保險支付。2童星送醫後，劇組人員仍留在現場將戲拍完。《甘味》製作人郭建宏指出，現場有設置鋼絲等防護措施，也有武術指導在場。他也坦言劇組確有疏失，該負的責任一定全部承擔，日後亦會加強安全措施。童星發生意外後，劇情會先調整，讓童星休息養傷。警方表示，這起童星自貨車上翻落的意外，不屬於交通事故，而劇組認為不須封路拍攝，所以事前並沒有向分局申請。(中國時報)校正編輯：吳毓敏,3,2015/10/23 00:00,578,http://www.chinatimes.com/newspapers/20151023000438-260106,2,ltn00372,《甘味》假戲真傷 2童星摔車
372,內湖區,北市內湖區一名黃男子為了躲避酒駕、逃避刑責，18日下午4時許，逆向進入安泰街38巷，結果前方死巷子無路可逃，黃男異想天開，跳入溪水中，以為躲的了一時，就能逃過一劫，但內溝溪內沒有任何遮蔽、躲藏的地方。員警隨後趕到，發現他機車停在路邊，從高處一望，清楚看到黃男在水裡行走，直接喊「趕快上來！別躲了。」警方表示，黃男酒測值0.49mg/L，從橋上跳入溪水，高度相差4公尺，一跳下去立刻左腿骨折、右腿骨裂，還出動消防人員幫忙，將黃男送到三軍總醫院治療。可能是受到酒精麻醉的效果，黃男上岸還不知道疼痛，不斷嗆警察：「不要急，難道是要我用飛的上來嗎！」員警說，要不是消防人員用安全梯，他泡在水裡面，至少要到明天酒精退去才會發現。★中時電子報關心您：飲酒過量，有礙健康！(中時即時)出版編輯：謝雅柔,4,2015/10/21 00:00,440,http://www.chinatimes.com/realtimenews/20151021004212-260402,2,ltn00373,酒醉男跳河導致雙腿骨折 僅為躲酒測
373,內湖區,（21:38更新）中信兄弟球迷要失望了！強棒許基宏在6局下轟出右外野陽春炮，把全場象迷情緒轟到最高點，可是外野球場外卻是靜悄悄，沒有任何慶賀的火煙冒出，因為「詐」彈客的關係，中信兄弟不能放煙火。其實中信兄弟球團原本準備大量的煙火、鞭炮要在球員打出全壘打與贏球賽後施放，送給球迷一個驚喜夜，可惜因炸彈恐嚇電話之故，球團被禁止燃放、還要吃上1張爆竹過量的罰單。據了解，靠近新莊棒球場外野的人工湖區，被發現爆竹數量超過120公斤，已逾法令規定的數量，遭到有關單位查獲、目前正在清點數量後，稍後將會開立罰單。中信兄弟表示，這是他們的的煙火，準備在球員打出全壘打時燃放、還有贏球賽後的慶祝活動，準備分量多是想給球迷激情夜的驚喜。不過，今天早上出現炸彈恐嚇電話後，警方禁止球團進行施放煙火的慶賀活動，避免橫生枝節，球團也只能配合，只不過，這些煙火、爆竹還來不及撤回，就被主管單位查到數量不符規定。(中時電子報)出版編輯：陳志祥,5,2015/10/20 00:00,3440,http://www.chinatimes.com/realtimenews/20151020004599-260403,2,ltn00374,恐嚇炸彈後遺症   許基宏陽春炮靜悄悄
374,內湖區,爬山要小心手杖不要亂揮！一名邱姓男子，今年6月28日下午，在內湖區攀爬忠勇山步道，手杖不小心碰觸擦肩而過的女登山客，讓人誤以為是邱男用手捏對方臀部，女登山客當時並沒有出言制止，但回家後越想越不舒服，憤而到警局提出性騷擾告訴。邱男接到警局通知書始知挨告，且大喊冤枉，陪同爬山的邱太太也出庭澄清，當時2人一起爬山，太太走在後面，看到先生右手拿手杖，根本沒有「餘力」可以捏別人臀部，猜想是手杖不小心碰到，讓人誤以為刺痛是被捏，檢方調查後，以查無積極證據處份不起訴。(中時即時)出版編輯：林柏安,6,2015/10/19 00:00,2262,http://www.chinatimes.com/realtimenews/20151019003091-260402,2,ltn00375,登山客手杖碰到她臀部 女怒告性騷擾
375,內湖區,"住展雜誌今（15）日上午公布最新調查，從民國100年至今年9月，大台北都會區各行政區新建房屋與人口變化，依2.78人（全國平均家戶人口數）需要一戶住家來計算住宅缺口，發現在住宅缺貨最嚴重的前十名中，新北市有三區、台北市有七區；前六名行政區住宅缺口均逾千戶以上，其中內湖區更高達2,690戶，搶下第一。台北市則因近年新建案少，不少行政區都供不應求，大同、南港與內湖的房子短缺占前三名。住展雜誌企研室經理何世昌表示，雖然內湖是台北市推案規模最龐大的行政區之一，近4年多共新增3千多戶房子，但蓋房子的速度還跟不上人口成長速度。同期間內湖人口暴增約1.6萬人，住宅還短缺2千多戶，成為大台北最缺房子的地區！至於新北市，擠進這項排行榜單的行政區則有八里、三峽與樹林，分別盤踞第十、第八和第四名。何世昌分析，即使少子化情況嚴竣，但台灣人口往都會區集中的趨勢更加明顯，主要都會區人口與購屋需求仍然居高不下；尤其是大台北，人口數占逾全國總人口數逾四分之一，有不少區域新建房屋數量還趕不上人口成長，因此近幾年內房市還不致於受到少子化議題干擾。若購屋者有疑慮，不妨可改到人口紅利區買房，比較不用擔心未來轉手問題。(工商即時)出版編輯：林淑燕",7,2015/10/15 00:00,746,http://www.chinatimes.com/realtimenews/20151015002411-260410,2,ltn00376,大台北都會區缺房率 內湖拿第一
376,內湖區,,8,,,http://www.chinatimes.com/newspapers/20151016000688-260102,2,ltn00377,
