_id,area,content,count,date,likes,link,page,pk,title
128,松山區,台北市議會「型男議員」戴錫欽，今年初遭《周刊王》獨家披露3度「車會」美女議員許淑華。《周刊王》調查後發現，戴仍與老婆同住，夫妻感情似乎未受影響；然而在9月16日深夜，戴遭直擊隻身進入知名情色按摩店，一待就是3小時。當晚8點左右，戴錫欽從住家開車，來到南京東路五段的「京華城男女舒壓時尚館」。或許不想引人注意，明明店家門口有泊車服務，他依然自行駕駛到附近的收費停車場，再步行回店，隨即被服務小姐帶往2樓包廂，直到深夜近11點半，他才下樓結帳，神情輕鬆愉快地返家。記者兩次入店內消費，向兩位按摩小姐查證，均表示可私下提供俗稱做半套的「手工服務」，店家不干涉，但要另外收費，價格約1000~1500元。轄區的松山分局表示，該店曾因此數度遭檢舉，但從未被查獲。女經理「阿玉」澄清，店內禁止小姐在包廂替客人進性服務，戴錫欽則無回應。八仙樂園粉塵爆炸案10月16日偵結，八仙董座陳柏廷和總經理陳慧穎姊弟，獲不起訴處分；他們委任的律師來頭不小，來自於前檢察總長陳聰明擔任榮譽所長的明永法律事務所。「明永」主持律師絲漢德和曾益盛，分別是檢察官與法官出身，為陳柏廷辯護的絲漢德是陳聰明的女婿。陳柏廷還加聘曾任台北地院法官的林政憲律師聯手辯護，果然成功撇清刑責。外界推測，律師花費相當可觀，難怪遭起訴的呂忠吉直嘆「司法真的是有錢人玩的」。本期隨刊附贈「亞洲男神」李敏鎬跨頁帥照！更多精采內容，詳見今天上市的《周刊王》。(中國時報),19,2015/10/21 00:00,7972,http://www.chinatimes.com/newspapers/20151021000481-260106,4,ltn00129,戴錫欽撇妻 進情色按摩店
129,松山區,房市納涼，觀望氣氛未能突破，購屋大眾置產意願低落，最新調查發現，台北市現在每100戶中，購屋戶數平均不到2戶，只有1.88戶。大家房屋今（19）日公布最新調查指出，今年全台六都，相較去年同期，都呈現衰退。其中，衰落最多的區域在桃園市，下滑1.94個百分點；但累計前三季平均購屋比為3.46％，還算全台最高。大家房屋副總經理劉明哲表示，現階段交易量無法突破，主要在於買賣雙方對房價認知差異大，台北市房價高門檻高，置產者固然較少，新北市話題不如去年多，因此下滑了1.72個百分點。至於台中，有交通建設支撐，今年家戶購屋比3.19%；台南、高雄方面，受整體房市影響小，衰退幅度較小，現階段皆以自住戶為主，台南家戶購屋比2.06%，高雄2.30%，表現較穩定。大家房屋統計今年前三季「家戶購屋比」，台北市1.88%最低，平均每100戶中不到2戶購屋，而相較去年同期，六都皆呈現衰退趨勢，衰落最多的區域在桃園市，下滑1.94個百分點，台北市房價高，置產門檻高，故家戶購屋比最低；而桃園市雖然下滑最多，但也是今年家戶購屋比最高的區域，平均每100戶就有3.46戶購屋，郎美囡指出，桃園市去年在航空城話題下締造了高交易量，今年雖然航空城計畫可能生變，但桃園市房價相對較低，交通建設話題性支撐，加上生活機能豐富，還是吸引購屋人在此置產。(工商即時)出版編輯：任鳳儀,20,2015/10/19 00:00,1745,http://www.chinatimes.com/realtimenews/20151019002374-260410,4,ltn00130,北市房市納涼 每100戶不到2戶購屋
130,松山區,上屆高中籃球聯賽(HBL)冠軍松山高中，提前在長耀盃高中籃球賽展現強烈衛冕氣勢！全場跟南山高中一路糾纏的松山，靠著最後10.6秒「丁丁」丁聖儒飆進逆轉三分彈，終場72比68驚險氣走南山，松山隊史首次在長耀盃奪冠，丁聖儒獲選男生組MVP，最佳教練是松山黃萬隆。高國豪繼續拿出全能發揮，貢獻全場最高23分、且有9籃板、4助攻、4抄截，唯一美中不足的是他也出現7失誤，陳建銘15分，帶著嘴唇傷勢上場的孫思堯14分、15籃板及5火鍋，丁聖儒13分、4籃板與3抄截；南山則以簡家暐14分、9籃板及3助攻表現較佳。(中時電子報)出版編輯：黃及人,21,2015/10/18 00:00,571,http://www.chinatimes.com/realtimenews/20151018003322-260403,4,ltn00131,長耀盃松山首次封王 丁聖儒MVP
131,松山區,台南市登革熱防疫工作9月中旬由中央接手，1個月來病例數終於下降，環保署長魏國彥18日帶著管考人員南下視察「防堵與切穿」策略成果，記取經驗作為明年工作要點，並與台南市長賴清德互相稱頌，認為中央、地方相互合作，才是防疫成功關鍵。魏國彥提出生物滅絕有兩大因素，第一是棲地消失，第二是棲地破碎化，政府推廣孳生源清除，就是讓蚊子的棲地大幅消失，另外棲地的破碎化，就是依照生物的地理學，開始進行「防堵與切穿」工作。「簡單說，就是防堵森林失火的概念」魏國彥以國外防止森林火勢蔓延為比喻，在火勢外圍開闢防火巷，如同登革熱防疫開闢防堵圈，迫使蚊子的棲地破碎化。且分成四期執行，目前已完成前三期。高雄去年1萬4千例登革熱病例數，直到11月初才下降，台南在10月中旬獲得控制，魏國彥認為「防堵與切穿」策略已有初步成效，18日帶了管考人員南下，了解作業過程，繼取今年的台南經驗，作為明年登革熱工作的推動依據。賴清德18日向環保人員深深鞠躬，表達感謝人員辛苦防疫，感謝環保署提供的專業技術與見解，將疫情降溫歸功於中央與地方政府互相合作，沒有互踢皮球，並指稱這在過去相當少見，並希望藉由防治登革熱疫情，市民動員孳清，可以台南這城市變得更乾淨、美麗。(中時即時)出版編輯：林柏安,22,2015/10/18 00:00,1446,http://www.chinatimes.com/realtimenews/20151018001884-260407,4,ltn00132,台南登革熱疫情趨緩 環保署長率隊南下視察
132,松山區,中信兄弟牛棚今天在總冠軍賽第2戰守住戰局，4位後援投手全部沒有失分，其中林英傑中繼2局、中信兄弟又贏球，他打破自己參與的總冠軍戰17連敗的魔咒，林英傑說：「心中的石頭可以放下了！」今天中信兄弟牛棚杜家明、林英傑、謝榮豪與陳鴻文都沒有掉分，林英傑中繼5、6局沒有被安打、送出3K，終場中信兄弟又贏球，林英傑打破輸球的魔咒，賽後他捧著肚子說：「在休息區看得很緊張，胃都痛了，第一次看球看到胃痛。」今天中信兄弟扳回一城，讓總冠軍戰打成1勝1敗，林英傑也破了魔咒，他指出，這是大家的努力，大家堅持到最後，他的內心也較好過，既然破咒，他希望往後繼續加油。林英傑強調：「洋將人力有限，贏球還是要靠本土投手的努力，其中牛棚是重要的力量。」林英傑從台灣大聯盟雷公到中職誠泰隊、興農牛、義大隊與中信兄弟參與了17場總冠軍比賽輸球。(中時電子報)出版編輯：陳志祥,23,2015/10/18 00:00,1522,http://www.chinatimes.com/realtimenews/20151018003352-260403,4,ltn00133,中信兄弟林英傑打破17連敗魔咒
133,松山區,繼複賽輸給南山高中28分，U16中華隊今天又上了1堂震撼教育，力拚40分鐘難破「綠色神盾」北市松山的招牌防守，終場59比82失利，只能打明天下午5點40分的長耀盃季軍賽，對手將是南湖。8連勝、且屬唯一不敗之師的松山，晚上7時20分將與南山爭冠，尋求首度封王。連遭HBL「雙山」先後洗禮，U16中華教頭吳正杰說，松山既強又硬，相形下，U16小將明顯太嫩，除了破不了松山全場壓迫，本身方法也打不來，防守卡位又不確實，防守籃板全面失守，光在總籃板，松山47個，含進攻籃板27個。前30分鐘絲毫未鬆手，松山教頭黃萬隆說，大比數勝出，這並非「上課」或刺激中華U16，而是盡全力打，讓小1、2歲的小國手找出自身攻防的不足。談到這批U16小國手，黃萬隆說，高度還OK，整體素質卻略不及2000年亞青賽、田壘為代表的那屆。松山「兩百」孫思堯15分、8籃板，高國豪17分、10籃板、5抄截、2助攻，丁聖儒助攻、抄截各3；U16中華隊以高承恩12分最高，張鎮衙11分、林庭謙10分，唐維傑僅4分、3籃板，教頭吳正杰表示，唐維傑不見了，他是有能力、也被寄予厚望的，得快醒來。(中時電子報)出版編輯：黃及人,24,2015/10/17 00:00,507,http://www.chinatimes.com/realtimenews/20151017004322-260403,4,ltn00134,給小老弟上課 松山晉級長耀盃決賽
134,松山區,《Airway世界民航雜誌》與松山機場合辦的2015年度第三季航空市民舞台活動「航空知識講座II」，於10月17日上午9時30分在松山機場3樓觀景台盛大舉行，共有約150名民眾到場參與，前後歷時3小時，共分為空姐講堂、機長講堂、Q&A;時間、幸運抽獎與世界民航雜誌出版的新書Mook05簽書會等5大部分，活動於中午12時30分圓滿結束。由於2014年12月所舉辦的航空市民舞台活動「航空知識講座」獲得民眾熱烈迴響，《Airway世界民航雜誌》再次邀請Airway 專欄作家─順風機長，進行第二次的航空知識講座，講解「飛機起飛遭遇發動機失效的處置」，並開放現場Q&A;時間，回答現場民眾關於飛行或飛機的提問。現場也另邀請現役資深空姐Nitta，對客艙內時常遇到的一些問題與疑難雜症進行解說，並分享航班上趣味橫生的旅客百態。活動最後《Airway世界民航雜誌》提供精美金屬飛機模型、機長熊玩偶與《Airway世界民航雜誌》新作Mook系列叢書第5集「世界主要航空公司」等幸運抽獎獎項給參與民眾，並由新書法籍作者Manuel Negrerie在現場進行簽書會。《Airway世界民航雜誌》於2012年開始與松山機場公司合作，每季於松山機場觀景台舉辦航空市民舞台活動，主旨在於增加民眾對航空業的瞭解，並回饋台北市民。《Airway世界民航雜誌》自1997年7月創刊，已發行220期，是東亞地區唯一一本繁體中文專業民航月刊雜誌，在台灣、香港與中國大陸兩岸三地皆有發行。(工商即時)出版編輯：郭匡超,25,2015/10/17 00:00,813,http://www.chinatimes.com/realtimenews/20151017002749-260405,4,ltn00135,松山機場航空市民舞台 機長、空姐開講
135,松山區,松山高中今天雖在長耀盃男生組8強戰，首節跟東泰高中打成18比18平手，卻在第2節發揮「綠色神盾」本色，單節只讓對手拿到6分，進攻則靠上屆高中籃球聯賽MVP高國豪單節貢獻11分，一舉拉開雙方差距，松山終場83比56大勝東泰，明天準決賽將跟U16中華隊交手。高國豪拿下22分、8籃板，可是三分球投6中1，松山教練黃萬隆並未責怪這名愛將，反而強調全隊都累了，「我們從信念盃一路打到現在，所有主力身體都很疲倦，我只希望大家保持專注，努力比完長耀盃就好。」呂蔡瑜倫也有13分，陳建銘12分、4籃板。松山全場發生28失誤，比東泰還多5次，其中先發控衛「丁丁」丁聖儒只打20分鐘，卻出現全隊最多的5失誤，黃萬隆賽後還特別把丁聖儒念了一頓，丁聖儒說：「我確實出現過多失誤，黃教練罵我也應該，只是這麼多天都在比賽，我們真的都累了。」(中時電子報)出版編輯：黃及人,26,2015/10/16 00:00,638,http://www.chinatimes.com/realtimenews/20151016004280-260403,5,ltn00136,「神盾」防守奏效 松山挺進4強
136,松山區,日本動漫《進擊的巨人》自暑假起靠真人版、動畫電影席捲漫迷，緊接著「進擊的巨人展WALL TAIPEI」12月11日接力登陸台灣！實體大小的巨人，將現身台北松山文創園區。田中千繪、鯰魚哥和導演陳玉勳16日迫不及待推廣從日本原裝來台的「巨人展」，展現瘋動漫的一面。億萬導演也成鐵粉曾執導電影《總舖師》的陳玉勳是超級《巨人》迷，最愛在家屏息收看《巨人》卡通，享受緊湊刺激的快感。他最愛女主角米卡莎，封她是「甄珍等級的女神」。由於展覽開放攝影，他最大心願，就是想在看展時「跟米卡莎合照」。主持人黃子佼虧他：「億萬票房的導演怎麼變成怪伯伯，感覺宅宅der。」田中千繪昨以米卡莎的造型現身，看似簡單的服裝，花了她20分鐘才穿上，笑稱Cosplay一點也不輕鬆。她最喜歡《巨人》裡的台詞，如「人在放棄戰鬥的時候才算輸，堅持戰鬥就不算輸」，藉此砥礪自己。足跡影子現身台北「巨人展」去年從東京開跑，陸續巡迴到作者諫山創的故鄉展出，已超過30萬人朝聖。「巨人展」的台北執行委員會表示，昨天活動透過TVBS線上轉播，在毫無宣傳的狀況下，竟超過１萬2000人收看；執委會看好台灣動漫迷的潛力，預估３個月的展期可再吸30萬人，追平日本的觀展人次。距離正式開展還有１個多月，天母的日僑小學已經搶先見識到「巨人足跡」入侵校園，淡水、台北街頭也陸續可見巨人身影。展覽中則請到中、日聲優配音雙語導覽，並首創360度體感劇場，要《巨人》迷親身體驗成為兵團的一員。「巨人展」門票即日起可上KKTIX、全家FamiPort預購。(中國時報)校正編輯：林宜靜,27,2015/10/17 00:00,1049,http://www.chinatimes.com/newspapers/20151017000644-260112,5,ltn00137,進擊的巨人松山文創開展！陳玉勳見米卡莎1秒變宅
137,松山區,前任台北市長郝龍斌，投入基隆市立委選舉，勤跑基層，承諾將以治理台北市經驗為基隆市民謀福利。基隆市位於北北基生活圈的外圍，基隆市的交通內部郝將引入台北市的捷運經驗，研擬過交通部預算的郝龍斌，也提到可以空汙基金發展基隆的大眾交通運輸，將基隆與台北的連結做得更加緊密。郝龍斌擔任台北市長八年，任內完成各項建設，各區市民運動中心，串聯全區河濱自行車道、三重、蘆洲、信義、松山等線通車。松山機場成為國際機場。從台北往來東京、首爾、中國大陸更為便利。台北首創的Ubike，更是結合了運動與慢活理念。基隆市要如何不繼續在北北基中被邊緣化，擁有更好的生活機能，或許最近勤跑基層的郝龍斌將有答案。【郝龍斌小檔案】學歷臺北市立成功高級中學畢業國立臺灣大學農業化學系畢業美國麻州州立大學食品科技博士經歷中華民國紅十字會總會顧問立法院（第三屆）委員行政院環境保護署（第六任）署長中華民國紅十字會秘書長臺北市市長（第四屆）臺北市市長（第五屆）中國國民黨副主席臺北市政府顧問(中時電子報)出版編輯：陳慧仙校正編輯：謝宗龍,28,2015/10/16 00:00,4/10,http://www.chinatimes.com/realtimenews/20151016002929-260407,5,ltn00138,基隆／台北治理經驗替基隆謀福利
138,松山區,西松高中秘書黃加明表示，學生約在中午12點25至30分之間從5樓教室走廊墜樓，校方發現後送國軍松山醫院急救，但醫院下午2點28分通知學校，這名學生急救無效、宣告不治。黃加明表示，這名男學生就讀自然組，高一高二成績表現中等，但人際、出缺勤狀況正常，也沒有任何病史。墜樓現場並未有遺書，事前老師與同學也未發現異狀，但因5樓的女兒牆與不鏽鋼欄杆皆有約半個人高，墜樓原因還待警方調查。黃加明說，事發當時5樓、1樓各有一名學生與老師目擊狀況，校方將墜樓學生送醫後，也啟動悲傷輔導。(中時即時)出版編輯：丁世傑校正編輯：徐秀娥,29,2015/10/12 00:00,8676,http://www.chinatimes.com/realtimenews/20151012003948-260402,5,ltn00139,西松高中學生午休墜樓 不治身亡
139,松山區,《鄉愁》這首簡短的詩，對我們來說再熟悉不過了，透過詩，我們以為自己看到了台灣。然而，那麼對岸人民的內心真的都是這樣子嗎？我們在被濾的一絲雜質不剩的新聞中，一遍遍證實我們狂熱的民族心，進而確信世界局勢就是我們想看到的那樣子。當然隨大流的想法是最安全的，即使對事實一無所知，也可以裝作義憤填膺的樣子，捍衛脆弱的群體尊嚴，並在其中獲得道德的自豪感。然而也可以至少什麼都不說，靜靜的去感受就好。因為赴台灣升學的緣故，我得以有機會第一次去到台北，也有機會花較長的時間待在台北。我搭乘的飛機降落在傍晚時分的台北松山機場。這一個靠近市區的機場，讓我在飛機還未落地，就可以迫不及待地觀賞到市區的夜景。眼中的台北，熟悉，好像讓我覺得是大陸的某一個城市，有密密麻麻的建築，交通幹道上車流不息；陌生，因為從來沒有到過，並且淅瀝滴著雨，潮溼到無處落腳。進入這個城市的第一站，便是久聞其名的台北捷運。繁體字書寫的指示牌，沒一、兩分鐘就來一班的列車，時代感與現代感的交融，在這個城市的每一個角落彌漫著。這個城市留下了太多日治時代的痕跡，古樸的樓宇，橫生交錯的小巷，整潔的街道，行人也多，但沒有覺得凌亂，也沒有吵吵嚷嚷。有很現代化的裝飾，嵌套在很破舊的大樓上。從大陸的大城市過來的人，或許會覺得台北不像大城市。整個城市不大，高樓很少，建築不華麗，到哪都能看的到101大樓。這裡的人民也如韓寒《太平洋的風》所寫，禮貌友善，服務讓人受寵若驚。或許，這個城市之下看不見的東西，恰恰是我們所缺少的。同一個民族的兩個地區分隔一個多世紀之久，前半個世紀是因為一場侵略，後半個世紀是因為一場內戰。統一，似乎是大陸的心病，獨立，估計是另一岸的歸屬。兩岸遙遙相望，除了地域上那一灣淺淺的海峽，還有兩岸人民心中不了解與不交流的鴻溝。對於兩岸的未來，究竟要往何處去？不同一邊都可以迫不及待拋出一大堆看法，並且可以是截然相反，非此即彼，有我無你，勢不兩立。在這種關乎對立的問題上，一切理性的思考和客觀的分析，都可以被強烈的民族情感、自由主義所淹沒。對於大陸，勢必想要盡快與台灣統一；對於台灣，則更多的形成「台灣」認同，與「中國」的概念不同。而統一的人，究竟想要統一什麼，是中國版圖更大，還是台灣人民生活更好？獨立的人，僅僅想擺脫中國的影響，還是為了尋求台灣更好的出路？當我們在談兩岸關係的時候，我們在談什麼，我們有沒有將自己的觀點強加於他人之上？法西斯從來沒有停止過，因為排除異己的思想隨處可見；恐怖主義也將繼續，因為崇尚暴力征服的觀念獲得了掌聲。原本美好的事情，總有製造真相者的攪局。我們的出生帶著膚色、配上戶籍，那我們真實的靈魂就是這些嗎？讓戶籍來決定我們一生的思考？我不想讓膚色與戶籍代表我的想法，我只想代表我自己，讓歷史得到它想要的答案。無論各自立場如何，即使未必相一致，但至少要能夠銘記歷史。銘記歷史不是讓我們仇恨，而是讓我們保持警醒。(旺報),30,2015/10/13 00:00,1160,http://www.chinatimes.com/newspapers/20151013001039-260306,5,ltn00140,鄉愁的另一邊
140,松山區,為期9天的2015年桃園亞太聽障運動會今日圓滿落幕，中華隊挾著地主優勢一舉奪得27金、17銀、21銅，不但高居獎牌榜第一，技壓各參賽國家，更創下歷屆參賽最佳成績；本屆賽事代言人王世偉在田徑賽200公尺及400公尺接力摘下2面金牌，100公與1600公尺接力項目拿2面銀牌，成為本屆賽事風雲人物。桃園市政府晚間在桃園市立體育館特地席開100桌，宴請各國菁英選手，讓為期9天的精彩賽事圓滿落幕。桃園市首度承辦綜合性國際賽事，籌備處盡全力在場地、競賽、交通及醫護等各方面提供優質的服務，期盼能讓遠道而來的朋友留下美好的回憶。市長特別感謝國際聽障運動總會、亞太聽障運動總會及教育部體育署的指導，主辦單位中華民國聽障者體育運動協會及本府各局處、學校等精心籌劃本屆賽事，齊心為本屆賽事努力。大會會長鄭文燦表示，感謝各國參賽的優秀選手及隊職員在整個賽事中的努力與付出，帶給觀眾如此精彩的國際級賽事，往後如果還有機會，桃園也將盡力做到更好。此外，大會也非常感謝中華民國各單項協會、國立體育大學、桃園市體育會各單項委員會及所有參與本次賽會之志工們等全力支援，沒有大家全力支持，賽事無法順利圓滿。因為有你們的協助與無私的付出，得以成就本次賽會，在在展現台灣民眾對於舉辦體育賽事的重視及支持，也感謝所有參與本賽事的來賓以及本市民眾的熱情參與。本次大會特以油紙傘結合各國國旗作為開閉幕進場單位牌，於賽會尾聲將桃園市的心意獻給各國代表團，表達歡迎及感謝之意。此外，今日的閉幕典禮桃園市以台灣傳統「辦桌」的方式呈現，精心挑選十道菜色，除了象徵十全十美外，更融合了桃園各區特色食材，希望各國選手感受獨具桃園魅力之特色餐飲，依序為大溪豆干拼盤、觀音蓮子八寶飯、石門蔥油活魚、大園無骨香油雞、復興蜜桃排骨酥、中壢新明牛肉湯、蘆竹脆筍燉四寶、八德時疏扣干貝、龍泉飄香綠豆糕以及桃園當季水果等款待貴賓，勢必令人口齒留香，流連忘返。本賽會閉幕歡送晚宴係由萬能科技大學餐飲管理系為各國選手獻上美味佳餚，並結合永平工商餐飲科以亂打秀及花式調酒帶來精彩的上菜秀，為晚宴揭開序幕，接著，宋坤傳藝將帶來璀璨晶龍及祈福千手鼓表演，以「龍耀臺灣」意味「榮耀台灣」，並透過千手鼓的表演為所有朋友送上祝福；再由剛拿下2015世界歐亞聽障選美比賽亞洲區冠軍的林靖嵐率隊帶來精彩的舞蹈表演；接著由桃園市政府客家事務局輔導的萍影舞集帶來富有客家風情的演出；國家級表演團隊九天民俗技藝團也將帶來富有濃濃臺灣味的演出；最後由屢次在全國原住民舞蹈比賽之常勝軍，來自桃園的原林舞集，帶來原住民族傳統舞蹈，並與選手共舞，好不熱鬧，此外，也將透過閉幕花絮之影片為大家做賽事精彩回顧。本賽事從賽程安排、場地規劃、傷害防護、接待、交通、醫療、住宿等，桃園市都是用最認真的態度來接待這群安靜的勇士，賽事、賽務均獲國際官員及各國領隊、選手的讚許。推展體育向來都是政府重要的工作，特別是針對弱勢族群，桃園市未來將多加舉辦特殊族群的體育活動，讓他們有機會接觸人群，並給予肯定自我的舞台，因此，我們特別重視及支持本次賽事。希望透過本賽會帶動民眾關注體育活動，也同時喚起全民對於聽障運動的重視，進而給予支持。明年2月份，台灣燈會將在桃園舉辦，歡迎所有喜愛桃園的朋友再次造訪本市，體驗桃園之美。(中時電子報)出版編輯：黃邱倫,31,2015/10/11 00:00,607,http://www.chinatimes.com/realtimenews/20151011002967-260403,5,ltn00141,亞太聽障運動會落幕 中華隊27金最風光
141,松山區,儘管上屆HBL新人王兼MVP高國豪今天讀秒階段4罰中1，松山高中仍以71比68險勝南湖高中，預賽3戰全勝、D組第1挺進12強複賽，賽後松山教練黃萬隆怒摔水瓶發洩，今天拿下17分、5籃板及3助攻的高國豪說：「我想當時罰球自己有點急，其實我不緊張，應可罰進才對。」高國豪坦承，從上屆HBL協助松山奪冠至今，他認為自己最大問題，仍在學習如何帶領球隊，「我的溝通能力不好，很少會去主動出聲講話，儘管我在賽前不斷練習出聲，卻一直沒法做好。至於個人球技，我的運球仍然不好，不少基本動作也要加強，還需繼續努力學習。」為何最後關頭4罰中1？高國豪表示，前兩次罰球都沒進，讓他更急著想要彌補回來，結果第3罰又沒進，連他自己都很意外，「我想這就跟我們當前團隊狀況一樣，包含我在內，都需磨合與調整。」陳建銘替松山拿下16分，莊家誠也有12分、11籃板。黃萬隆賽後倒是並不怪罪高國豪4罰中1，畢竟高國豪先在最後21秒投進穩住戰局的三分球，松山才有辦法留住勝利，黃萬隆說：「我們真的累了，從打完信念盃到現在，我們已經連9天打了10場比賽，這是場耐力考驗，我只能用人員輪轉因應，甚至孫思堯感冒剛好，今天就必須要上。」(中時電子報)出版編輯：黃及人,32,2015/10/11 00:00,821,http://www.chinatimes.com/realtimenews/20151011002981-260403,6,ltn00142,松山長耀盃全勝晉級 高國豪學當領袖
